"No.","Time","Source","Destination","Protocol","Length","Info"
"1","0.000000","104.208.16.90","172.20.48.201","TLSv1.3","4212","Server Hello, Change Cipher Spec"
"2","0.000055","172.20.48.201","104.208.16.90","TCP","54","65319  >  443 [ACK] Seq=1 Ack=4159 Win=1024 Len=0"
"3","0.000106","104.208.16.90","172.20.48.201","TCP","1440","443  >  65319 [PSH, ACK] Seq=4159 Ack=1 Win=254 Len=1386 [TCP PDU reassembled in 5]"
"4","0.000123","172.20.48.201","104.208.16.90","TCP","54","65319  >  443 [ACK] Seq=1 Ack=5545 Win=1024 Len=0"
"5","0.000207","104.208.16.90","172.20.48.201","TLSv1.3","913","Application Data"
"6","0.000230","172.20.48.201","104.208.16.90","TCP","54","65319  >  443 [ACK] Seq=1 Ack=6404 Win=1020 Len=0"
"7","0.013762","172.20.48.201","104.208.16.90","TLSv1.3","134","Change Cipher Spec, Application Data"
"8","0.013946","172.20.48.201","104.208.16.90","TLSv1.3","1051","Application Data"
"9","0.017013","104.208.16.90","172.20.48.201","TCP","60","443  >  65319 [ACK] Seq=6404 Ack=81 Win=254 Len=0"
"10","0.017013","104.208.16.90","172.20.48.201","TCP","60","443  >  65319 [ACK] Seq=6404 Ack=1078 Win=251 Len=0"
"11","0.041753","52.182.143.215","172.20.48.201","TLSv1.2","152","Application Data"
"12","0.042534","172.20.48.201","52.182.143.215","TLSv1.2","89","Application Data"
"13","0.045133","52.182.143.215","172.20.48.201","TCP","60","443  >  65218 [ACK] Seq=99 Ack=36 Win=353 Len=0"
"14","0.252622","104.208.16.90","172.20.48.201","TLSv1.3","157","Application Data"
"15","0.252716","172.20.48.201","104.208.16.90","TCP","54","65319  >  443 [ACK] Seq=1078 Ack=6507 Win=1020 Len=0"
"16","0.498512","104.208.16.90","172.20.48.201","TLSv1.3","500","Application Data"
"17","0.498588","172.20.48.201","104.208.16.90","TCP","54","65319  >  443 [ACK] Seq=1078 Ack=6953 Win=1024 Len=0"
"18","1.307749","172.20.48.201","172.64.146.98","TCP","55","65245  >  443 [ACK] Seq=1 Ack=1 Win=255 Len=1"
"19","1.313360","172.64.146.98","172.20.48.201","TCP","66","443  >  65245 [ACK] Seq=1 Ack=2 Win=8 Len=0 SLE=1 SRE=2"
"20","4.347498","172.20.48.201","3.233.158.26","TCP","55","65271  >  443 [ACK] Seq=1 Ack=1 Win=255 Len=1 [TCP PDU reassembled in 396]"
"21","4.350172","3.233.158.26","172.20.48.201","TCP","66","443  >  65271 [ACK] Seq=1 Ack=2 Win=95 Len=0 SLE=1 SRE=2"
"22","6.073939","172.20.48.201","8.8.8.8","TCP","55","65237  >  443 [ACK] Seq=1 Ack=1 Win=253 Len=1"
"23","6.077642","8.8.8.8","172.20.48.201","TCP","66","443  >  65237 [ACK] Seq=1 Ack=2 Win=246 Len=0 SLE=1 SRE=2"
"24","6.273807","104.199.241.202","172.20.48.201","SSL","65","Continuation Data"
"25","6.322908","172.20.48.201","104.199.241.202","TCP","54","64737  >  443 [ACK] Seq=1 Ack=12 Win=251 Len=0"
"26","6.629588","172.20.48.201","239.255.255.250","SSDP","212","M-SEARCH * HTTP/1.1 "
"27","6.817764","172.20.48.201","239.255.255.250","SSDP","217","M-SEARCH * HTTP/1.1 "
"28","7.632260","172.20.48.201","239.255.255.250","SSDP","212","M-SEARCH * HTTP/1.1 "
"29","7.820653","172.20.48.201","239.255.255.250","SSDP","217","M-SEARCH * HTTP/1.1 "
"30","7.943067","172.20.48.201","104.18.32.47","TCP","1440","65213  >  443 [ACK] Seq=1 Ack=1 Win=253 Len=1386 [TCP PDU reassembled in 35]"
"31","7.943067","172.20.48.201","104.18.32.47","TCP","1440","65213  >  443 [ACK] Seq=1387 Ack=1 Win=253 Len=1386 [TCP PDU reassembled in 35]"
"32","7.943067","172.20.48.201","104.18.32.47","TCP","1440","65213  >  443 [ACK] Seq=2773 Ack=1 Win=253 Len=1386 [TCP PDU reassembled in 35]"
"33","7.943067","172.20.48.201","104.18.32.47","TCP","1440","65213  >  443 [ACK] Seq=4159 Ack=1 Win=253 Len=1386 [TCP PDU reassembled in 35]"
"34","7.943067","172.20.48.201","104.18.32.47","TCP","1440","65213  >  443 [ACK] Seq=5545 Ack=1 Win=253 Len=1386 [TCP PDU reassembled in 35]"
"35","7.943067","172.20.48.201","104.18.32.47","TLSv1.2","139","Application Data"
"36","7.943305","172.20.48.201","104.18.32.47","TLSv1.2","93","Application Data"
"37","7.943367","172.20.48.201","104.18.32.47","TLSv1.2","668","Application Data"
"38","7.944862","172.20.48.201","13.107.6.158","TLSv1.2","160","Application Data"
"39","7.945071","172.20.48.201","13.107.6.158","TLSv1.2","93","Application Data"
"40","7.945143","172.20.48.201","13.107.6.158","TLSv1.2","114","Application Data"
"41","7.945432","172.20.48.201","52.111.252.16","TLSv1.2","128","Application Data"
"42","7.945551","172.20.48.201","52.111.252.16","TLSv1.2","100","Application Data"
"43","7.945614","172.20.48.201","52.111.252.16","TLSv1.2","471","Application Data"
"44","7.946877","104.18.32.47","172.20.48.201","TCP","60","443  >  65213 [ACK] Seq=1 Ack=1387 Win=97 Len=0"
"45","7.946877","104.18.32.47","172.20.48.201","TCP","60","443  >  65213 [ACK] Seq=1 Ack=2773 Win=97 Len=0"
"46","7.946877","104.18.32.47","172.20.48.201","TCP","60","443  >  65213 [ACK] Seq=1 Ack=4159 Win=97 Len=0"
"47","7.946953","104.18.32.47","172.20.48.201","TCP","60","443  >  65213 [ACK] Seq=1 Ack=5545 Win=97 Len=0"
"48","7.946953","104.18.32.47","172.20.48.201","TCP","60","443  >  65213 [ACK] Seq=1 Ack=6931 Win=97 Len=0"
"49","7.946953","104.18.32.47","172.20.48.201","TCP","60","443  >  65213 [ACK] Seq=1 Ack=7016 Win=97 Len=0"
"50","7.946953","104.18.32.47","172.20.48.201","TCP","60","443  >  65213 [ACK] Seq=1 Ack=7055 Win=97 Len=0"
"51","7.946953","104.18.32.47","172.20.48.201","TCP","60","443  >  65213 [ACK] Seq=1 Ack=7669 Win=97 Len=0"
"52","7.947870","13.107.6.158","172.20.48.201","TCP","60","443  >  65216 [ACK] Seq=1 Ack=206 Win=243 Len=0"
"53","7.948924","52.111.252.16","172.20.48.201","TCP","60","443  >  65217 [ACK] Seq=1 Ack=538 Win=753 Len=0"
"54","7.951472","13.107.6.158","172.20.48.201","TLSv1.2","93","Application Data"
"55","8.006958","172.20.48.201","13.107.6.158","TCP","54","65216  >  443 [ACK] Seq=206 Ack=40 Win=253 Len=0"
"56","8.011564","104.18.32.47","172.20.48.201","TLSv1.2","93","Application Data"
"57","8.040098","52.111.252.16","172.20.48.201","TLSv1.2","100","Application Data"
"58","8.057204","172.20.48.201","104.18.32.47","TCP","54","65213  >  443 [ACK] Seq=7669 Ack=40 Win=253 Len=0"
"59","8.063169","13.107.6.158","172.20.48.201","TLSv1.2","403","Application Data, Application Data"
"60","8.064000","172.20.48.201","13.107.6.158","TLSv1.2","89","Application Data"
"61","8.084571","172.20.48.201","52.111.252.16","TCP","54","65217  >  443 [ACK] Seq=538 Ack=47 Win=255 Len=0"
"62","8.086905","52.111.252.16","172.20.48.201","TLSv1.2","304","Application Data, Application Data, Application Data"
"63","8.087858","172.20.48.201","52.111.252.16","TLSv1.2","96","Application Data"
"64","8.108119","13.107.6.158","172.20.48.201","TCP","60","443  >  65216 [ACK] Seq=389 Ack=241 Win=243 Len=0"
"65","8.138591","52.111.252.16","172.20.48.201","TCP","60","443  >  65217 [ACK] Seq=297 Ack=580 Win=753 Len=0"
"66","8.202724","172.20.48.201","13.107.6.158","TLSv1.2","163","Application Data"
"67","8.202896","172.20.48.201","13.107.6.158","TLSv1.2","115","Application Data"
"68","8.206503","13.107.6.158","172.20.48.201","TCP","60","443  >  65216 [ACK] Seq=389 Ack=350 Win=243 Len=0"
"69","8.206503","13.107.6.158","172.20.48.201","TCP","60","443  >  65216 [ACK] Seq=389 Ack=411 Win=243 Len=0"
"70","8.320129","13.107.6.158","172.20.48.201","TLSv1.2","405","Application Data, Application Data"
"71","8.362574","172.20.48.201","13.107.6.158","TCP","54","65216  >  443 [ACK] Seq=411 Ack=740 Win=255 Len=0"
"72","8.363582","172.20.48.201","4.224.92.204","TLSv1.2","104","Application Data"
"73","8.386122","4.224.92.204","172.20.48.201","TLSv1.2","93","Application Data"
"74","8.414402","172.20.48.201","52.111.252.16","TLSv1.2","128","Application Data"
"75","8.414570","172.20.48.201","52.111.252.16","TLSv1.2","473","Application Data"
"76","8.414862","172.20.48.201","13.107.6.158","TLSv1.2","160","Application Data"
"77","8.414968","172.20.48.201","13.107.6.158","TLSv1.2","116","Application Data"
"78","8.417746","52.111.252.16","172.20.48.201","TCP","60","443  >  65217 [ACK] Seq=297 Ack=654 Win=753 Len=0"
"79","8.417746","52.111.252.16","172.20.48.201","TCP","60","443  >  65217 [ACK] Seq=297 Ack=1073 Win=764 Len=0"
"80","8.417746","13.107.6.158","172.20.48.201","TCP","60","443  >  65216 [ACK] Seq=740 Ack=517 Win=243 Len=0"
"81","8.417746","13.107.6.158","172.20.48.201","TCP","60","443  >  65216 [ACK] Seq=740 Ack=579 Win=243 Len=0"
"82","8.439947","172.20.48.201","4.224.92.204","TCP","54","64763  >  443 [ACK] Seq=51 Ack=40 Win=251 Len=0"
"83","8.508491","52.111.252.16","172.20.48.201","TLSv1.2","96","Application Data"
"84","8.550263","172.20.48.201","52.111.252.16","TCP","54","65217  >  443 [ACK] Seq=1073 Ack=339 Win=254 Len=0"
"85","8.554009","52.111.252.16","172.20.48.201","TLSv1.2","239","Application Data, Application Data"
"86","8.596985","172.20.48.201","52.111.252.16","TCP","54","65217  >  443 [ACK] Seq=1073 Ack=524 Win=253 Len=0"
"87","8.597265","172.20.48.201","35.186.224.40","TLSv1.2","82","Application Data"
"88","8.599537","35.186.224.40","172.20.48.201","TCP","60","443  >  64727 [ACK] Seq=1 Ack=29 Win=253 Len=0"
"89","8.642819","172.20.48.201","239.255.255.250","SSDP","212","M-SEARCH * HTTP/1.1 "
"90","8.647147","104.18.32.47","172.20.48.201","TLSv1.2","603","Application Data"
"91","8.689351","172.20.48.201","104.18.32.47","TCP","54","65213  >  443 [ACK] Seq=7669 Ack=589 Win=250 Len=0"
"92","8.693000","104.18.32.47","172.20.48.201","TLSv1.2","87","Application Data"
"93","8.705048","172.20.48.201","104.18.32.47","TLSv1.2","89","Application Data"
"94","8.707915","104.18.32.47","172.20.48.201","TCP","60","443  >  65213 [ACK] Seq=622 Ack=7704 Win=97 Len=0"
"95","8.830287","172.20.48.201","239.255.255.250","SSDP","217","M-SEARCH * HTTP/1.1 "
"96","8.888909","104.18.32.47","172.20.48.201","TCP","5598","443  >  65213 [PSH, ACK] Seq=622 Ack=7704 Win=97 Len=5544 [TCP PDU reassembled in 101]"
"97","8.888909","104.18.32.47","172.20.48.201","TCP","1440","443  >  65213 [PSH, ACK] Seq=6166 Ack=7704 Win=97 Len=1386 [TCP PDU reassembled in 101]"
"98","8.889012","172.20.48.201","104.18.32.47","TCP","54","65213  >  443 [ACK] Seq=7704 Ack=7552 Win=255 Len=0"
"99","8.889077","104.18.32.47","172.20.48.201","TCP","1440","443  >  65213 [PSH, ACK] Seq=7552 Ack=7704 Win=97 Len=1386 [TCP PDU reassembled in 101]"
"100","8.889077","104.18.32.47","172.20.48.201","TCP","2826","443  >  65213 [PSH, ACK] Seq=8938 Ack=7704 Win=97 Len=2772 [TCP PDU reassembled in 101]"
"101","8.889077","104.18.32.47","172.20.48.201","TLSv1.2","983","Application Data, Application Data"
"102","8.889109","172.20.48.201","104.18.32.47","TCP","54","65213  >  443 [ACK] Seq=7704 Ack=12639 Win=255 Len=0"
"103","8.970888","172.20.48.201","23.206.173.137","TCP","55","65269  >  443 [ACK] Seq=1 Ack=1 Win=506 Len=1"
"104","8.973597","23.206.173.137","172.20.48.201","TCP","66","443  >  65269 [ACK] Seq=1 Ack=2 Win=482 Len=0 SLE=1 SRE=2"
"105","9.655340","172.20.48.201","239.255.255.250","SSDP","212","M-SEARCH * HTTP/1.1 "
"106","9.844752","172.20.48.201","239.255.255.250","SSDP","217","M-SEARCH * HTTP/1.1 "
"107","10.439783","172.20.48.201","52.111.252.16","TLSv1.2","128","Application Data"
"108","10.440125","172.20.48.201","52.111.252.16","TLSv1.2","481","Application Data"
"109","10.443037","52.111.252.16","172.20.48.201","TCP","60","443  >  65217 [ACK] Seq=524 Ack=1147 Win=764 Len=0"
"110","10.443037","52.111.252.16","172.20.48.201","TCP","60","443  >  65217 [ACK] Seq=524 Ack=1574 Win=775 Len=0"
"111","10.473763","13.107.6.158","172.20.48.201","TLSv1.2","376","Application Data"
"112","10.527705","172.20.48.201","13.107.6.158","TCP","54","65216  >  443 [ACK] Seq=579 Ack=1062 Win=254 Len=0"
"113","10.530525","13.107.6.158","172.20.48.201","TLSv1.2","85","Application Data"
"114","10.545316","52.111.252.16","172.20.48.201","TLSv1.2","96","Application Data"
"115","10.574765","172.20.48.201","13.107.6.158","TCP","54","65216  >  443 [ACK] Seq=579 Ack=1093 Win=254 Len=0"
"116","10.589401","172.20.48.201","52.111.252.16","TCP","54","65217  >  443 [ACK] Seq=1574 Ack=566 Win=253 Len=0"
"117","10.594946","52.111.252.16","172.20.48.201","TLSv1.2","262","Application Data, Application Data"
"118","10.610279","172.20.48.201","172.20.72.11","DNS","70","Standard query 0x9e6b A dns.google"
"119","10.610432","172.20.48.201","172.20.72.11","DNS","70","Standard query 0x4fd8 HTTPS dns.google"
"120","10.613859","172.20.72.11","172.20.48.201","DNS","102","Standard query response 0x9e6b A dns.google A 8.8.4.4 A 8.8.8.8"
"121","10.613859","172.20.72.11","172.20.48.201","DNS","146","Standard query response 0x4fd8 HTTPS dns.google SOA ns1.zdns.google"
"122","10.614511","172.20.48.201","8.8.4.4","TCP","66","65322  >  443 [SYN] Seq=0 Win=65535 Len=0 MSS=1460 WS=256 SACK_PERM"
"123","10.621678","8.8.4.4","172.20.48.201","TCP","66","443  >  65322 [SYN, ACK] Seq=0 Ack=1 Win=65535 Len=0 MSS=1386 SACK_PERM WS=256"
"124","10.621736","172.20.48.201","8.8.4.4","TCP","54","65322  >  443 [ACK] Seq=1 Ack=1 Win=65280 Len=0"
"125","10.622365","172.20.48.201","8.8.4.4","TCP","1440","65322  >  443 [ACK] Seq=1 Ack=1 Win=65280 Len=1386 [TCP PDU reassembled in 126]"
"126","10.622365","172.20.48.201","8.8.4.4","TLSv1.3","484","Client Hello (SNI=dns.google)"
"127","10.625477","8.8.4.4","172.20.48.201","TCP","60","443  >  65322 [ACK] Seq=1 Ack=1387 Win=64256 Len=0"
"128","10.625477","8.8.4.4","172.20.48.201","TCP","60","443  >  65322 [ACK] Seq=1 Ack=1817 Win=64000 Len=0"
"129","10.636861","172.20.48.201","52.111.252.16","TCP","54","65217  >  443 [ACK] Seq=1574 Ack=774 Win=252 Len=0"
"130","10.662323","8.8.4.4","172.20.48.201","TLSv1.3","4212","Server Hello, Change Cipher Spec"
"131","10.662323","8.8.4.4","172.20.48.201","TLSv1.3","85","Application Data"
"132","10.662383","172.20.48.201","8.8.4.4","TCP","54","65322  >  443 [ACK] Seq=1817 Ack=4190 Win=65280 Len=0"
"133","10.663051","172.20.48.201","8.8.4.4","TLSv1.3","128","Change Cipher Spec, Application Data"
"134","10.663245","172.20.48.201","8.8.4.4","TLSv1.3","146","Application Data"
"135","10.663388","172.20.48.201","8.8.4.4","TLSv1.3","298","Application Data"
"136","10.663424","172.20.48.201","8.8.4.4","TLSv1.3","245","Application Data"
"137","10.665153","8.8.4.4","172.20.48.201","TCP","60","443  >  65322 [ACK] Seq=4190 Ack=1891 Win=64000 Len=0"
"138","10.665153","8.8.4.4","172.20.48.201","TCP","60","443  >  65322 [ACK] Seq=4190 Ack=1983 Win=64000 Len=0"
"139","10.665153","8.8.4.4","172.20.48.201","TCP","60","443  >  65322 [ACK] Seq=4190 Ack=2227 Win=64000 Len=0"
"140","10.665153","8.8.4.4","172.20.48.201","TCP","60","443  >  65322 [ACK] Seq=4190 Ack=2418 Win=64000 Len=0"
"141","10.670951","8.8.4.4","172.20.48.201","TLSv1.3","1004","Application Data, Application Data"
"142","10.671324","172.20.48.201","8.8.4.4","TLSv1.3","85","Application Data"
"143","10.674340","8.8.4.4","172.20.48.201","TLSv1.3","940","Application Data, Application Data, Application Data, Application Data, Application Data"
"144","10.674897","172.20.48.201","8.8.4.4","TLSv1.3","93","Application Data"
"145","10.677459","8.8.4.4","172.20.48.201","TLSv1.3","667","Application Data, Application Data, Application Data"
"146","10.678389","172.20.48.201","104.208.16.90","TCP","66","65323  >  443 [SYN] Seq=0 Win=65535 Len=0 MSS=1460 WS=256 SACK_PERM"
"147","10.729253","172.20.48.201","8.8.4.4","TCP","54","65322  >  443 [ACK] Seq=2488 Ack=6639 Win=64768 Len=0"
"148","10.930421","172.20.48.201","13.107.6.158","TLSv1.2","160","Application Data"
"149","10.930538","172.20.48.201","13.107.6.158","TLSv1.2","125","Application Data"
"150","10.933517","13.107.6.158","172.20.48.201","TCP","60","443  >  65216 [ACK] Seq=1093 Ack=685 Win=243 Len=0"
"151","10.933517","13.107.6.158","172.20.48.201","TCP","60","443  >  65216 [ACK] Seq=1093 Ack=756 Win=243 Len=0"
"152","10.934721","172.20.48.201","104.208.16.90","TCP","66","65324  >  443 [SYN] Seq=0 Win=65535 Len=0 MSS=1460 WS=256 SACK_PERM"
"153","10.936204","104.208.16.90","172.20.48.201","TCP","66","443  >  65323 [SYN, ACK] Seq=0 Ack=1 Win=65535 Len=0 MSS=1386 WS=256 SACK_PERM"
"154","10.936307","172.20.48.201","104.208.16.90","TCP","54","65323  >  443 [ACK] Seq=1 Ack=1 Win=65280 Len=0"
"155","10.937101","172.20.48.201","104.208.16.90","TCP","1440","65323  >  443 [ACK] Seq=1 Ack=1 Win=65280 Len=1386 [TCP PDU reassembled in 156]"
"156","10.937101","172.20.48.201","104.208.16.90","TLSv1.3","409","Client Hello (SNI=teams.events.data.microsoft.com)"
"157","10.939699","104.208.16.90","172.20.48.201","TCP","60","443  >  65323 [ACK] Seq=1 Ack=1387 Win=64256 Len=0"
"158","10.939699","104.208.16.90","172.20.48.201","TCP","60","443  >  65323 [ACK] Seq=1 Ack=1742 Win=64000 Len=0"
"159","10.965858","172.20.48.201","52.182.143.215","TLSv1.2","134","Application Data"
"160","10.965931","172.20.48.201","52.182.143.215","TLSv1.2","93","Application Data"
"161","10.965961","172.20.48.201","52.182.143.215","TLSv1.2","843","Application Data"
"162","10.968769","52.182.143.215","172.20.48.201","TCP","60","443  >  65218 [ACK] Seq=99 Ack=116 Win=353 Len=0"
"163","10.968769","52.182.143.215","172.20.48.201","TCP","60","443  >  65218 [ACK] Seq=99 Ack=155 Win=353 Len=0"
"164","10.968769","52.182.143.215","172.20.48.201","TCP","60","443  >  65218 [ACK] Seq=99 Ack=944 Win=364 Len=0"
"165","11.120584","172.20.48.201","35.186.224.40","TLSv1.2","97","Application Data"
"166","11.123303","35.186.224.40","172.20.48.201","TCP","60","443  >  64744 [ACK] Seq=1 Ack=44 Win=245 Len=0"
"167","11.136476","172.20.48.201","8.8.4.4","TCP","55","65220  >  443 [ACK] Seq=1 Ack=1 Win=250 Len=1 [TCP PDU reassembled in 3825]"
"168","11.139656","8.8.4.4","172.20.48.201","TCP","66","443  >  65220 [ACK] Seq=1 Ack=2 Win=266 Len=0 SLE=1 SRE=2"
"169","11.200454","104.208.16.90","172.20.48.201","TLSv1.3","153","Hello Retry Request, Change Cipher Spec"
"170","11.201466","172.20.48.201","104.208.16.90","TLSv1.3","641","Change Cipher Spec, Client Hello (SNI=teams.events.data.microsoft.com)"
"171","11.202697","52.182.143.215","172.20.48.201","TLSv1.2","93","Application Data"
"172","11.204751","104.208.16.90","172.20.48.201","TCP","60","443  >  65323 [ACK] Seq=100 Ack=2329 Win=63488 Len=0"
"173","11.205854","104.208.16.90","172.20.48.201","TCP","66","443  >  65324 [SYN, ACK] Seq=0 Ack=1 Win=65535 Len=0 MSS=1386 WS=256 SACK_PERM"
"174","11.205900","172.20.48.201","104.208.16.90","TCP","54","65324  >  443 [ACK] Seq=1 Ack=1 Win=65280 Len=0"
"175","11.206441","172.20.48.201","104.208.16.90","TCP","1440","65324  >  443 [ACK] Seq=1 Ack=1 Win=65280 Len=1386 [TCP PDU reassembled in 176]"
"176","11.206441","172.20.48.201","104.208.16.90","TLSv1.3","473","Client Hello (SNI=teams.events.data.microsoft.com)"
"177","11.208109","35.186.224.40","172.20.48.201","TLSv1.2","94","Application Data"
"178","11.209124","104.208.16.90","172.20.48.201","TCP","60","443  >  65324 [ACK] Seq=1 Ack=1387 Win=64256 Len=0"
"179","11.209124","104.208.16.90","172.20.48.201","TCP","60","443  >  65324 [ACK] Seq=1 Ack=1806 Win=64000 Len=0"
"180","11.245352","172.20.48.201","52.182.143.215","TCP","54","65218  >  443 [ACK] Seq=944 Ack=138 Win=252 Len=0"
"181","11.261285","172.20.48.201","35.186.224.40","TCP","54","64744  >  443 [ACK] Seq=44 Ack=41 Win=255 Len=0"
"182","11.277125","172.20.48.201","23.206.173.122","TCP","55","65272  >  443 [ACK] Seq=1 Ack=1 Win=253 Len=1"
"183","11.279830","23.206.173.122","172.20.48.201","TCP","66","443  >  65272 [ACK] Seq=1 Ack=2 Win=485 Len=0 SLE=1 SRE=2"
"184","11.308232","172.20.48.201","35.186.224.24","TCP","55","65264  >  443 [ACK] Seq=1 Ack=1 Win=255 Len=1 [TCP PDU reassembled in 8179]"
"185","11.311883","35.186.224.24","172.20.48.201","TCP","66","443  >  65264 [ACK] Seq=1 Ack=2 Win=244 Len=0 SLE=1 SRE=2"
"186","11.323159","172.20.48.201","35.186.224.24","TCP","55","65265  >  443 [ACK] Seq=1 Ack=1 Win=251 Len=1 [TCP PDU reassembled in 7475]"
"187","11.329015","35.186.224.24","172.20.48.201","TCP","66","443  >  65265 [ACK] Seq=1 Ack=2 Win=241 Len=0 SLE=1 SRE=2"
"188","11.369984","172.20.48.201","23.206.173.128","TCP","55","65266  >  443 [ACK] Seq=1 Ack=1 Win=250 Len=1"
"189","11.373075","23.206.173.128","172.20.48.201","TCP","66","443  >  65266 [ACK] Seq=1 Ack=2 Win=484 Len=0 SLE=1 SRE=2"
"190","11.476437","172.20.48.201","52.111.252.16","TLSv1.2","128","Application Data"
"191","11.476512","172.20.48.201","52.111.252.16","TLSv1.2","485","Application Data"
"192","11.476679","104.208.16.90","172.20.48.201","TLSv1.3","153","Hello Retry Request, Change Cipher Spec"
"193","11.478086","172.20.48.201","104.208.16.90","TLSv1.3","705","Change Cipher Spec, Client Hello (SNI=teams.events.data.microsoft.com)"
"194","11.478703","52.111.252.16","172.20.48.201","TCP","60","443  >  65217 [ACK] Seq=774 Ack=1648 Win=775 Len=0"
"195","11.478703","52.111.252.16","172.20.48.201","TCP","60","443  >  65217 [ACK] Seq=774 Ack=2079 Win=786 Len=0"
"196","11.480775","104.208.16.90","172.20.48.201","TCP","60","443  >  65324 [ACK] Seq=100 Ack=2457 Win=63488 Len=0"
"197","11.481963","52.182.143.215","172.20.48.201","TLSv1.2","152","Application Data"
"198","11.482592","172.20.48.201","52.182.143.215","TLSv1.2","89","Application Data"
"199","11.485745","52.182.143.215","172.20.48.201","TCP","60","443  >  65218 [ACK] Seq=236 Ack=979 Win=364 Len=0"
"200","11.509677","172.20.48.201","52.123.164.110","TLSv1.2","104","Application Data"
"201","11.510330","104.208.16.90","172.20.48.201","TLSv1.3","4212","Server Hello"
"202","11.510518","172.20.48.201","104.208.16.90","TCP","54","65323  >  443 [ACK] Seq=2329 Ack=4258 Win=65280 Len=0"
"203","11.510587","104.208.16.90","172.20.48.201","TCP","1440","443  >  65323 [ACK] Seq=4258 Ack=2329 Win=63488 Len=1386 [TCP PDU reassembled in 204]"
"204","11.510587","104.208.16.90","172.20.48.201","TLSv1.3","916","Application Data"
"205","11.510620","172.20.48.201","104.208.16.90","TCP","54","65323  >  443 [ACK] Seq=2329 Ack=6506 Win=65280 Len=0"
"206","11.513639","172.20.48.201","104.208.16.90","TLSv1.3","128","Application Data"
"207","11.513862","172.20.48.201","104.208.16.90","TLSv1.3","146","Application Data"
"208","11.514074","172.20.48.201","104.208.16.90","TLSv1.3","700","Application Data"
"209","11.514148","172.20.48.201","104.208.16.90","TCP","1440","65323  >  443 [ACK] Seq=3141 Ack=6506 Win=65280 Len=1386 [TCP PDU reassembled in 211]"
"210","11.514148","172.20.48.201","104.208.16.90","TCP","1440","65323  >  443 [ACK] Seq=4527 Ack=6506 Win=65280 Len=1386 [TCP PDU reassembled in 211]"
"211","11.514148","172.20.48.201","104.208.16.90","TLSv1.3","1160","Application Data"
"212","11.516481","104.208.16.90","172.20.48.201","TCP","60","443  >  65323 [ACK] Seq=6506 Ack=2403 Win=63488 Len=0"
"213","11.516481","104.208.16.90","172.20.48.201","TCP","60","443  >  65323 [ACK] Seq=6506 Ack=4527 Win=61696 Len=0"
"214","11.516481","104.208.16.90","172.20.48.201","TCP","60","443  >  65323 [ACK] Seq=6506 Ack=5913 Win=60416 Len=0"
"215","11.516481","104.208.16.90","172.20.48.201","TCP","60","443  >  65323 [ACK] Seq=6506 Ack=7019 Win=59392 Len=0"
"216","11.516481","104.208.16.90","172.20.48.201","TCP","60","443  >  65323 [ACK] Seq=6506 Ack=2495 Win=63488 Len=0"
"217","11.516481","104.208.16.90","172.20.48.201","TCP","60","443  >  65323 [ACK] Seq=6506 Ack=3141 Win=62976 Len=0"
"218","11.535179","52.123.164.110","172.20.48.201","TLSv1.2","93","Application Data"
"219","11.571643","52.111.252.16","172.20.48.201","TLSv1.2","96","Application Data"
"220","11.586946","172.20.48.201","52.123.164.110","TCP","54","64776  >  443 [ACK] Seq=51 Ack=40 Win=251 Len=0"
"221","11.618181","172.20.48.201","52.111.252.16","TCP","54","65217  >  443 [ACK] Seq=2079 Ack=816 Win=252 Len=0"
"222","11.621567","52.111.252.16","172.20.48.201","TLSv1.2","261","Application Data, Application Data"
"223","11.665350","172.20.48.201","52.111.252.16","TCP","54","65217  >  443 [ACK] Seq=2079 Ack=1023 Win=251 Len=0"
"224","11.673953","172.20.48.201","255.255.255.255","UDP","82","52506  >  1947 Len=40"
"225","11.673952","172.20.48.201","172.20.55.255","UDP","82","52505  >  1947 Len=40"
"226","11.726576","172.20.48.201","35.186.224.24","TCP","55","65238  >  443 [ACK] Seq=1 Ack=1 Win=250 Len=1 [TCP PDU reassembled in 506]"
"227","11.729252","35.186.224.24","172.20.48.201","TCP","66","443  >  65238 [ACK] Seq=1 Ack=2 Win=288 Len=0 SLE=1 SRE=2"
"228","11.759067","104.208.16.90","172.20.48.201","TLSv1.3","1440","Server Hello"
"229","11.760670","104.208.16.90","172.20.48.201","TCP","1440","443  >  65324 [ACK] Seq=1486 Ack=2457 Win=63488 Len=1386 [TCP PDU reassembled in 233]"
"230","11.760775","172.20.48.201","104.208.16.90","TCP","54","65324  >  443 [ACK] Seq=2457 Ack=2872 Win=65280 Len=0"
"231","11.761793","104.208.16.90","172.20.48.201","TCP","1440","443  >  65324 [ACK] Seq=2872 Ack=2457 Win=63488 Len=1386 [TCP PDU reassembled in 233]"
"232","11.761793","104.208.16.90","172.20.48.201","TCP","1440","443  >  65324 [ACK] Seq=4258 Ack=2457 Win=63488 Len=1386 [TCP PDU reassembled in 233]"
"233","11.761793","104.208.16.90","172.20.48.201","TLSv1.3","916","Application Data"
"234","11.761908","172.20.48.201","104.208.16.90","TCP","54","65324  >  443 [ACK] Seq=2457 Ack=6506 Win=65280 Len=0"
"235","11.762528","172.20.48.201","104.208.16.90","TLSv1.3","128","Application Data"
"236","11.765254","104.208.16.90","172.20.48.201","TCP","60","443  >  65324 [ACK] Seq=6506 Ack=2531 Win=63488 Len=0"
"237","11.791150","104.208.16.90","172.20.48.201","TLSv1.3","157","Application Data"
"238","11.835563","172.20.48.201","104.208.16.90","TCP","54","65323  >  443 [ACK] Seq=7019 Ack=6609 Win=65280 Len=0"
"239","11.840740","104.208.16.90","172.20.48.201","TLSv1.3","116","Application Data"
"240","11.841342","172.20.48.201","104.208.16.90","TLSv1.3","85","Application Data"
"241","11.843865","104.208.16.90","172.20.48.201","TCP","60","443  >  65323 [ACK] Seq=6671 Ack=7050 Win=59392 Len=0"
"242","11.899346","172.20.48.201","172.20.55.255","UDP","82","52505  >  1947 Len=40"
"243","11.899346","172.20.48.201","255.255.255.255","UDP","82","52506  >  1947 Len=40"
"244","12.027848","104.208.16.90","172.20.48.201","TLSv1.3","85","Application Data"
"245","12.036303","104.208.16.90","172.20.48.201","TLSv1.3","219","Application Data, Application Data"
"246","12.071370","172.20.48.201","104.208.16.90","TCP","54","65323  >  443 [ACK] Seq=7050 Ack=6702 Win=65280 Len=0"
"247","12.087467","172.20.48.201","104.208.16.90","TCP","54","65324  >  443 [ACK] Seq=2531 Ack=6671 Win=65280 Len=0"
"248","12.130426","172.20.48.201","35.186.224.22","TLSv1.2","138","Application Data"
"249","12.130645","172.20.48.201","35.186.224.22","TLSv1.2","93","Application Data"
"250","12.130746","172.20.48.201","35.186.224.22","TLSv1.2","793","Application Data"
"251","12.133669","35.186.224.22","172.20.48.201","TCP","60","443  >  65239 [ACK] Seq=1 Ack=85 Win=320 Len=0"
"252","12.133669","35.186.224.22","172.20.48.201","TCP","60","443  >  65239 [ACK] Seq=1 Ack=124 Win=320 Len=0"
"253","12.133669","35.186.224.22","172.20.48.201","TCP","60","443  >  65239 [ACK] Seq=1 Ack=863 Win=331 Len=0"
"254","12.134954","172.20.48.201","172.20.55.255","UDP","82","52505  >  1947 Len=40"
"255","12.134952","172.20.48.201","255.255.255.255","UDP","82","52506  >  1947 Len=40"
"256","12.140309","35.186.224.22","172.20.48.201","TLSv1.2","93","Application Data"
"257","12.160781","172.20.48.201","104.18.32.47","TCP","1440","65213  >  443 [ACK] Seq=7704 Ack=12639 Win=255 Len=1386 [TCP PDU reassembled in 261]"
"258","12.160781","172.20.48.201","104.18.32.47","TCP","1440","65213  >  443 [ACK] Seq=9090 Ack=12639 Win=255 Len=1386 [TCP PDU reassembled in 261]"
"259","12.160781","172.20.48.201","104.18.32.47","TCP","1440","65213  >  443 [ACK] Seq=10476 Ack=12639 Win=255 Len=1386 [TCP PDU reassembled in 261]"
"260","12.160781","172.20.48.201","104.18.32.47","TCP","1440","65213  >  443 [ACK] Seq=11862 Ack=12639 Win=255 Len=1386 [TCP PDU reassembled in 261]"
"261","12.160781","172.20.48.201","104.18.32.47","TLSv1.2","201","Application Data"
"262","12.160947","172.20.48.201","104.18.32.47","TLSv1.2","812","Application Data"
"263","12.164091","104.18.32.47","172.20.48.201","TCP","60","443  >  65213 [ACK] Seq=12639 Ack=9090 Win=97 Len=0"
"264","12.164091","104.18.32.47","172.20.48.201","TCP","60","443  >  65213 [ACK] Seq=12639 Ack=10476 Win=97 Len=0"
"265","12.164091","104.18.32.47","172.20.48.201","TCP","60","443  >  65213 [ACK] Seq=12639 Ack=11862 Win=97 Len=0"
"266","12.164091","104.18.32.47","172.20.48.201","TCP","60","443  >  65213 [ACK] Seq=12639 Ack=13248 Win=97 Len=0"
"267","12.164091","104.18.32.47","172.20.48.201","TCP","60","443  >  65213 [ACK] Seq=12639 Ack=13395 Win=97 Len=0"
"268","12.164091","104.18.32.47","172.20.48.201","TCP","60","443  >  65213 [ACK] Seq=12639 Ack=14153 Win=97 Len=0"
"269","12.181198","172.20.48.201","35.186.224.22","TCP","54","65239  >  443 [ACK] Seq=863 Ack=40 Win=251 Len=0"
"270","12.261104","35.186.224.22","172.20.48.201","TLSv1.2","137","Application Data"
"271","12.261743","172.20.48.201","35.186.224.22","TLSv1.2","93","Application Data"
"272","12.284980","104.208.16.90","172.20.48.201","TLSv1.3","350","Application Data"
"273","12.308914","35.186.224.22","172.20.48.201","TCP","60","443  >  65239 [ACK] Seq=123 Ack=902 Win=331 Len=0"
"274","12.337202","172.20.48.201","104.208.16.90","TCP","54","65323  >  443 [ACK] Seq=7050 Ack=6998 Win=65024 Len=0"
"275","12.368991","172.20.48.201","255.255.255.255","UDP","82","52506  >  1947 Len=40"
"276","12.369000","172.20.48.201","172.20.55.255","UDP","82","52505  >  1947 Len=40"
"277","12.449529","13.107.6.158","172.20.48.201","TLSv1.2","407","Application Data, Application Data"
"278","12.492726","172.20.48.201","13.107.6.158","TCP","54","65216  >  443 [ACK] Seq=756 Ack=1446 Win=253 Len=0"
"279","12.516720","172.20.48.201","13.107.6.158","TLSv1.2","160","Application Data"
"280","12.516828","172.20.48.201","13.107.6.158","TLSv1.2","134","Application Data"
"281","12.519751","172.20.48.201","52.111.252.16","TLSv1.2","132","Application Data"
"282","12.519886","13.107.6.158","172.20.48.201","TCP","60","443  >  65216 [ACK] Seq=1446 Ack=862 Win=243 Len=0"
"283","12.519886","13.107.6.158","172.20.48.201","TCP","60","443  >  65216 [ACK] Seq=1446 Ack=942 Win=243 Len=0"
"284","12.519902","172.20.48.201","52.111.252.16","TLSv1.2","491","Application Data"
"285","12.521805","52.111.252.16","172.20.48.201","TCP","60","443  >  65217 [ACK] Seq=1023 Ack=2157 Win=786 Len=0"
"286","12.521805","52.111.252.16","172.20.48.201","TCP","60","443  >  65217 [ACK] Seq=1023 Ack=2594 Win=797 Len=0"
"287","12.543776","104.18.32.47","172.20.48.201","TLSv1.2","345","Application Data"
"288","12.584764","172.20.48.201","104.18.32.47","TCP","54","65213  >  443 [ACK] Seq=14153 Ack=12930 Win=254 Len=0"
"289","12.589057","104.18.32.47","172.20.48.201","TLSv1.2","132","Application Data, Application Data"
"290","12.600022","172.20.48.201","255.255.255.255","UDP","82","52506  >  1947 Len=40"
"291","12.600034","172.20.48.201","172.20.55.255","UDP","82","52505  >  1947 Len=40"
"292","12.619557","52.111.252.16","172.20.48.201","TLSv1.2","96","Application Data"
"293","12.630228","172.20.48.201","104.18.32.47","TCP","54","65213  >  443 [ACK] Seq=14153 Ack=13008 Win=254 Len=0"
"294","12.662171","172.20.48.201","52.111.252.16","TCP","54","65217  >  443 [ACK] Seq=2594 Ack=1065 Win=251 Len=0"
"295","12.664989","52.111.252.16","172.20.48.201","TLSv1.2","262","Application Data, Application Data"
"296","12.691494","13.107.6.158","172.20.48.201","TLSv1.2","526","Application Data"
"297","12.709986","172.20.48.201","52.111.252.16","TCP","54","65217  >  443 [ACK] Seq=2594 Ack=1273 Win=250 Len=0"
"298","12.741639","172.20.48.201","13.107.6.158","TCP","54","65216  >  443 [ACK] Seq=942 Ack=1918 Win=251 Len=0"
"299","12.745275","13.107.6.158","172.20.48.201","TLSv1.2","85","Application Data"
"300","12.787975","172.20.48.201","13.107.6.158","TCP","54","65216  >  443 [ACK] Seq=942 Ack=1949 Win=251 Len=0"
"301","12.835101","172.20.48.201","255.255.255.255","UDP","82","52506  >  1947 Len=40"
"302","12.835108","172.20.48.201","172.20.55.255","UDP","82","52505  >  1947 Len=40"
"303","12.844575","172.20.48.201","13.107.6.158","TLSv1.2","160","Application Data"
"304","12.844742","172.20.48.201","13.107.6.158","TLSv1.2","135","Application Data"
"305","12.848863","13.107.6.158","172.20.48.201","TCP","60","443  >  65216 [ACK] Seq=1949 Ack=1048 Win=243 Len=0"
"306","12.848863","13.107.6.158","172.20.48.201","TCP","60","443  >  65216 [ACK] Seq=1949 Ack=1129 Win=243 Len=0"
"307","13.036255","172.20.48.201","3.233.158.26","TCP","55","65224  >  443 [ACK] Seq=1 Ack=1 Win=252 Len=1"
"308","13.039534","3.233.158.26","172.20.48.201","TCP","66","443  >  65224 [ACK] Seq=1 Ack=2 Win=79 Len=0 SLE=1 SRE=2"
"309","13.067169","172.20.48.201","172.20.55.255","UDP","82","52505  >  1947 Len=40"
"310","13.067169","172.20.48.201","255.255.255.255","UDP","82","52506  >  1947 Len=40"
"311","13.299629","172.20.48.201","172.20.55.255","UDP","82","52505  >  1947 Len=40"
"312","13.299629","172.20.48.201","255.255.255.255","UDP","82","52506  >  1947 Len=40"
"313","13.531263","172.20.48.201","172.20.55.255","UDP","82","52505  >  1947 Len=40"
"314","13.531263","172.20.48.201","255.255.255.255","UDP","82","52506  >  1947 Len=40"
"315","13.765782","172.20.48.201","172.20.55.255","UDP","82","52505  >  1947 Len=40"
"316","13.765792","172.20.48.201","255.255.255.255","UDP","82","52506  >  1947 Len=40"
"317","13.999136","172.20.48.201","255.255.255.255","UDP","82","52506  >  1947 Len=40"
"318","13.999136","172.20.48.201","172.20.55.255","UDP","82","52505  >  1947 Len=40"
"319","14.140967","172.20.48.201","172.20.55.255","UDP","86","57621  >  57621 Len=44"
"320","14.232943","172.20.48.201","172.20.55.255","UDP","82","52505  >  1947 Len=40"
"321","14.232942","172.20.48.201","255.255.255.255","UDP","82","52506  >  1947 Len=40"
"322","14.466934","172.20.48.201","255.255.255.255","UDP","82","52506  >  1947 Len=40"
"323","14.466962","172.20.48.201","172.20.55.255","UDP","82","52505  >  1947 Len=40"
"324","14.632252","13.107.6.158","172.20.48.201","TLSv1.2","407","Application Data, Application Data"
"325","14.634750","172.20.48.201","13.107.6.158","TLSv1.2","89","Application Data"
"326","14.637840","13.107.6.158","172.20.48.201","TCP","60","443  >  65216 [ACK] Seq=2302 Ack=1164 Win=243 Len=0"
"327","14.659552","172.20.48.201","13.107.6.158","TLSv1.2","163","Application Data"
"328","14.659697","172.20.48.201","13.107.6.158","TLSv1.2","143","Application Data"
"329","14.660074","172.20.48.201","52.111.252.16","TLSv1.2","128","Application Data"
"330","14.660175","172.20.48.201","52.111.252.16","TLSv1.2","500","Application Data"
"331","14.662610","13.107.6.158","172.20.48.201","TCP","60","443  >  65216 [ACK] Seq=2302 Ack=1273 Win=243 Len=0"
"332","14.662610","13.107.6.158","172.20.48.201","TCP","60","443  >  65216 [ACK] Seq=2302 Ack=1362 Win=243 Len=0"
"333","14.662610","52.111.252.16","172.20.48.201","TCP","60","443  >  65217 [ACK] Seq=1273 Ack=2668 Win=797 Len=0"
"334","14.662610","52.111.252.16","172.20.48.201","TCP","60","443  >  65217 [ACK] Seq=1273 Ack=3114 Win=808 Len=0"
"335","14.699470","172.20.48.201","255.255.255.255","UDP","82","52506  >  1947 Len=40"
"336","14.699649","172.20.48.201","172.20.55.255","UDP","82","52505  >  1947 Len=40"
"337","14.760760","52.111.252.16","172.20.48.201","TLSv1.2","96","Application Data"
"338","14.772185","13.107.6.158","172.20.48.201","TLSv1.2","373","Application Data"
"339","14.806984","172.20.48.201","52.111.252.16","TCP","54","65217  >  443 [ACK] Seq=3114 Ack=1315 Win=250 Len=0"
"340","14.810749","52.111.252.16","172.20.48.201","TLSv1.2","262","Application Data, Application Data"
"341","14.812952","172.20.48.201","52.111.252.16","TLSv1.2","96","Application Data"
"342","14.817155","52.111.252.16","172.20.48.201","TCP","60","443  >  65217 [ACK] Seq=1523 Ack=3156 Win=808 Len=0"
"343","14.821788","172.20.48.201","13.107.6.158","TCP","54","65216  >  443 [ACK] Seq=1362 Ack=2621 Win=254 Len=0"
"344","14.826357","13.107.6.158","172.20.48.201","TLSv1.2","85","Application Data"
"345","14.867513","172.20.48.201","13.107.6.158","TCP","54","65216  >  443 [ACK] Seq=1362 Ack=2652 Win=254 Len=0"
"346","14.892590","172.20.48.201","13.107.6.158","TLSv1.2","163","Application Data"
"347","14.892673","172.20.48.201","13.107.6.158","TLSv1.2","144","Application Data"
"348","14.895213","13.107.6.158","172.20.48.201","TCP","60","443  >  65216 [ACK] Seq=2652 Ack=1471 Win=243 Len=0"
"349","14.895213","13.107.6.158","172.20.48.201","TCP","60","443  >  65216 [ACK] Seq=2652 Ack=1561 Win=243 Len=0"
"350","14.929988","172.20.48.201","255.255.255.255","UDP","82","52506  >  1947 Len=40"
"351","14.929991","172.20.48.201","172.20.55.255","UDP","82","52505  >  1947 Len=40"
"352","15.019812","13.107.6.158","172.20.48.201","TLSv1.2","373","Application Data"
"353","15.068953","172.20.48.201","13.107.6.158","TCP","54","65216  >  443 [ACK] Seq=1561 Ack=2971 Win=253 Len=0"
"354","15.074075","13.107.6.158","172.20.48.201","TLSv1.2","85","Application Data"
"355","15.115025","172.20.48.201","13.107.6.158","TCP","54","65216  >  443 [ACK] Seq=1561 Ack=3002 Win=253 Len=0"
"356","15.133038","172.20.48.201","13.107.6.158","TLSv1.2","160","Application Data"
"357","15.133122","172.20.48.201","13.107.6.158","TLSv1.2","145","Application Data"
"358","15.137304","13.107.6.158","172.20.48.201","TCP","60","443  >  65216 [ACK] Seq=3002 Ack=1667 Win=243 Len=0"
"359","15.137304","13.107.6.158","172.20.48.201","TCP","60","443  >  65216 [ACK] Seq=3002 Ack=1758 Win=243 Len=0"
"360","15.161928","172.20.48.201","172.20.55.255","UDP","82","52505  >  1947 Len=40"
"361","15.161934","172.20.48.201","255.255.255.255","UDP","82","52506  >  1947 Len=40"
"362","15.399090","172.20.48.201","255.255.255.255","UDP","82","52506  >  1947 Len=40"
"363","15.399098","172.20.48.201","172.20.55.255","UDP","82","52505  >  1947 Len=40"
"364","15.486224","172.20.48.201","52.111.252.16","TLSv1.2","131","Application Data"
"365","15.486430","172.20.48.201","52.111.252.16","TLSv1.2","504","Application Data"
"366","15.490962","52.111.252.16","172.20.48.201","TCP","60","443  >  65217 [ACK] Seq=1523 Ack=3233 Win=808 Len=0"
"367","15.490962","52.111.252.16","172.20.48.201","TCP","60","443  >  65217 [ACK] Seq=1523 Ack=3683 Win=818 Len=0"
"368","15.590575","52.111.252.16","172.20.48.201","TLSv1.2","96","Application Data"
"369","15.632813","172.20.48.201","52.111.252.16","TCP","54","65217  >  443 [ACK] Seq=3683 Ack=1565 Win=255 Len=0"
"370","15.632950","172.20.48.201","255.255.255.255","UDP","82","52506  >  1947 Len=40"
"371","15.632961","172.20.48.201","172.20.55.255","UDP","82","52505  >  1947 Len=40"
"372","15.635647","52.111.252.16","172.20.48.201","TLSv1.2","239","Application Data, Application Data"
"373","15.679225","172.20.48.201","52.111.252.16","TCP","54","65217  >  443 [ACK] Seq=3683 Ack=1750 Win=255 Len=0"
"374","15.730694","13.107.6.158","172.20.48.201","TLSv1.2","406","Application Data, Application Data"
"375","15.773456","172.20.48.201","13.107.6.158","TCP","54","65216  >  443 [ACK] Seq=1758 Ack=3354 Win=251 Len=0"
"376","16.065021","172.20.48.201","13.107.6.158","TLSv1.2","160","Application Data"
"377","16.065172","172.20.48.201","13.107.6.158","TLSv1.2","148","Application Data"
"378","16.069716","13.107.6.158","172.20.48.201","TCP","60","443  >  65216 [ACK] Seq=3354 Ack=1864 Win=243 Len=0"
"379","16.069716","13.107.6.158","172.20.48.201","TCP","60","443  >  65216 [ACK] Seq=3354 Ack=1958 Win=243 Len=0"
"380","16.230208","13.107.6.158","172.20.48.201","TLSv1.2","405","Application Data, Application Data"
"381","16.273066","172.20.48.201","13.107.6.158","TCP","54","65216  >  443 [ACK] Seq=1958 Ack=3705 Win=255 Len=0"
